{"accuracy_claim":false,"authority_scope":"public_synthetic_probe_execution_only","auto_qlora_authorized":false,"decision_sha256":"sha256:eab5a409f166a254da737f0c224d7db3d11935c326d937f9c0456546ce9efeea","delta_qlora":{"compatible_failures":0,"distinct_roots":0,"eligible":false,"reason":"all observed failures are critical or retrieval failures"},"evaluation_receipt_sha256":"sha256:8b712853400c4b06e702250a937ef93f8fcfaeb7d108055a014d5dd9d8389038","execution_head":"a4d778d51ae80371223bef760cd99170e6d96662","execution_tree":"9674c0a8b7c9687b6506deba191657cdcc447e0b","freeze_sha256":"sha256:a94ccea8684cb7109d6568d86c91a8ca4fea344ad6e0bfc6422825a847b8aa81","nonclaims":["no_accuracy_claim","no_promotion_claim","no_training_authority","no_tenant_dataset_authority","no_independent_accuracy_denominator"],"promotion_claim":false,"result":{"cases":8,"critical_failure":6,"invented_values":0,"legacy_inline":0,"retrieval_error":6,"semantic_correct":2},"schema_version":1,"status":"DIAGNOSE","training_authorized":false}
